ID,Name,Type,Category,Accuracy,Base Power,PP,Description162,Super Fang,Normal,Physical,90,0,10,Deals damage to the target equal to half of its current HP
276,Superpower,Fighting,Physical,100,120,5,Lowers the user's Attack and Defense by 1 stage.
48,Supersonic,Normal,Status,55,0,20,Causes the target to become confused.
626,Supersonic Skystrike,Flying,Physical,True,1,1,Power is equal to the base move's Z-Power.
57,Surf,Water,Special,100,90,15,Damage doubles if the target is using Dive.
818,Surging Strikes,Water,Physical,100,25,5,Hits three times. This move is always a critical hit unless the target is under the effect of Lucky Chant or has the Battle Armor or Shell Armor Abilities.
207,Swagger,Normal,Status,85,0,15,Raises the target's Attack by 2 stages and confuses it.
256,Swallow,Normal,Status,True,0,10,The user restores its HP based on its Stockpile count. Restores 1/4 of its maximum HP if it's 1
186,Sweet Kiss,Fairy,Status,75,0,10,Causes the target to become confused.
230,Sweet Scent,Normal,Status,100,0,20,Lowers the target's evasiveness by 2 stages.
129,Swift,Normal,Special,True,60,20,This move does not check accuracy.
415,Switcheroo,Dark,Status,100,0,10,The user swaps its held item with the target's held item. Fails if either the user or the target is holding a Mail or Z-Crystal
14,Swords Dance,Normal,Status,True,0,20,Raises the user's Attack by 2 stages.
485,Synchronoise,Psychic,Special,100,120,10,The target is immune if it does not share a type with the user.
235,Synthesis,Grass,Status,True,0,5,The user restores 1/2 of its maximum HP if Delta Stream or no weather conditions are in effect or if the user is holding Utility Umbrella
33,Tackle,Normal,Physical,100,40,35,No additional effect.
294,Tail Glow,Bug,Status,True,0,20,Raises the user's Special Attack by 3 stages.
541,Tail Slap,Normal,Physical,85,25,10,Hits two to five times. Has a 1/3 chance to hit two or three times
39,Tail Whip,Normal,Status,100,0,30,Lowers the target's Defense by 1 stage.
366,Tailwind,Flying,Status,True,0,15,For 4 turns
36,Take Down,Normal,Physical,85,90,20,If the target lost HP
749,Tar Shot,Rock,Status,100,0,20,Lowers the target's Speed by 1 stage. Until the target switches out
269,Taunt,Dark,Status,100,0,20,Prevents the target from using non-damaging moves for its next three turns. Pokemon with the Oblivious Ability or protected by the Aroma Veil Ability are immune.
715,Tearful Look,Normal,Status,True,0,20,Lowers the target's Attack and Special Attack by 1 stage.
752,Teatime,Normal,Status,True,0,10,All active Pokemon consume their held Berries. This effect is not prevented by substitutes
546,Techno Blast,Normal,Special,100,120,5,This move's type depends on the user's held Drive.
630,Tectonic Rage,Ground,Physical,True,1,1,Power is equal to the base move's Z-Power.
298,Teeter Dance,Normal,Status,100,0,20,Causes the target to become confused.
477,Telekinesis,Psychic,Status,True,0,15,For 3 turns
100,Teleport,Psychic,Status,True,0,20,If this move is successful and the user has not fainted
805,Terrain Pulse,Normal,Special,100,50,10,Power doubles if the user is grounded and a terrain is active
168,Thief,Dark,Physical,100,60,25,If this attack was successful and the user has not fainted
614,Thousand Arrows,Ground,Physical,100,90,10,This move can hit airborne Pokemon
615,Thousand Waves,Ground,Physical,100,90,10,Prevents the target from switching out. The target can still switch out if it is holding Shed Shell or uses Baton Pass
37,Thrash,Normal,Physical,100,120,10,The user spends two or three turns locked into this move and becomes confused immediately after its move on the last turn of the effect if it is not already. This move targets an opposing Pokemon at random on each turn. If the user is prevented from moving
675,Throat Chop,Dark,Physical,100,80,15,For 2 turns
87,Thunder,Electric,Special,70,110,10,Has a 30% chance to paralyze the target. This move can hit a target using Bounce
85,Thunderbolt,Electric,Special,100,90,15,Has a 10% chance to paralyze the target.
819,Thunder Cage,Electric,Special,90,80,15,Prevents the target from switching for four or five turns (seven turns if the user is holding Grip Claw). Causes damage to the target equal to 1/8 of its maximum HP (1/6 if the user is holding Binding Band)
422,Thunder Fang,Electric,Physical,95,65,15,Has a 10% chance to paralyze the target and a 10% chance to flinch it.
823,Thunderous Kick,Fighting,Physical,100,90,10,Has a 100% chance to lower the target's Defense by 1 stage.
9,Thunder Punch,Electric,Physical,100,75,15,Has a 10% chance to paralyze the target.
84,Thunder Shock,Electric,Special,100,40,30,Has a 10% chance to paralyze the target.
86,Thunder Wave,Electric,Status,90,0,20,Paralyzes the target. This move does not ignore type immunity.
321,Tickle,Normal,Status,100,0,20,Lowers the target's Attack and Defense by 1 stage.
576,Topsy-Turvy,Dark,Status,True,0,20,The target's positive stat stages become negative and vice versa. Fails if all of the target's stat stages are 0.
259,Torment,Dark,Status,100,0,15,Prevents the target from selecting the same move for use two turns in a row. This effect ends when the target is no longer active.
92,Toxic,Poison,Status,90,0,10,Badly poisons the target. If a Poison-type Pokemon uses this move
390,Toxic Spikes,Poison,Status,True,0,20,Sets up a hazard on the opposing side of the field
672,Toxic Thread,Poison,Status,100,0,20,Lowers the target's Speed by 1 stage and poisons it.
144,Transform,Normal,Status,True,0,10,The user transforms into the target. The target's current stats
161,Tri Attack,Normal,Special,100,80,10,Has a 20% chance to either burn
271,Trick,Psychic,Status,100,0,10,The user swaps its held item with the target's held item. Fails if either the user or the target is holding a Mail or Z-Crystal
567,Trick-or-Treat,Ghost,Status,100,0,20,Causes the Ghost type to be added to the target
433,Trick Room,Psychic,Status,True,0,5,For 5 turns
813,Triple Axel,Ice,Physical,90,20,10,Hits three times. Power increases to 40 for the second hit and 60 for the third. This move checks accuracy for each hit
167,Triple Kick,Fighting,Physical,90,10,10,Hits three times. Power increases to 20 for the second hit and 30 for the third. This move checks accuracy for each hit
688,Trop Kick,Grass,Physical,100,70,15,Has a 100% chance to lower the target's Attack by 1 stage.
376,Trump Card,Normal,Special,True,0,5,The power of this move is based on the amount of PP remaining after normal PP reduction and the Pressure Ability resolve. 200 power for 0 PP
41,Twineedle,Bug,Physical,100,25,20,Hits twice
656,Twinkle Tackle,Fairy,Physical,True,1,1,Power is equal to the base move's Z-Power.
239,Twister,Dragon,Special,100,40,20,Has a 20% chance to flinch the target. Power doubles if the target is using Bounce
369,U-turn,Bug,Physical,100,70,20,If this move is successful and the user has not fainted
253,Uproar,Normal,Special,100,90,10,The user spends three turns locked into this move. This move targets an opponent at random on each turn. On the first of the three turns
410,Vacuum Wave,Fighting,Special,100,40,30,No additional effect.
557,V-create,Fire,Physical,95,180,5,Lowers the user's Speed
741,Veevee Volley,Normal,Physical,True,0,20,Power is equal to the greater of (user's Happiness * 2/5)
599,Venom Drench,Poison,Status,100,0,20,Lowers the target's Attack
474,Venoshock,Poison,Special,100,65,10,Power doubles if the target is poisoned.
22,Vine Whip,Grass,Physical,100,45,25,No additional effect.
11,Vise Grip,Normal,Physical,100,55,30,No additional effect.
233,Vital Throw,Fighting,Physical,True,70,10,This move does not check accuracy.
521,Volt Switch,Electric,Special,100,70,20,If this move is successful and the user has not fainted
344,Volt Tackle,Electric,Physical,100,120,15,Has a 10% chance to paralyze the target. If the target lost HP
358,Wake-Up Slap,Fighting,Physical,100,70,10,Power doubles if the target is asleep. If the user has not fainted
127,Waterfall,Water,Physical,100,80,15,Has a 20% chance to flinch the target.
55,Water Gun,Water,Special,100,40,25,No additional effect.
518,Water Pledge,Water,Special,100,80,10,If one of the user's allies chose to use Fire Pledge or Grass Pledge this turn and has not moved yet
352,Water Pulse,Water,Special,100,60,20,Has a 20% chance to confuse the target.
594,Water Shuriken,Water,Special,100,15,20,Hits two to five times. Has a 1/3 chance to hit two or three times
346,Water Sport,Water,Status,True,0,15,For 5 turns
323,Water Spout,Water,Special,100,150,5,Power is equal to (user's current HP * 150 / user's maximum HP)
311,Weather Ball,Normal,Special,100,50,10,Power doubles if a weather condition other than Delta Stream is active
250,Whirlpool,Water,Special,85,35,15,Prevents the target from switching for four or five turns (seven turns if the user is holding Grip Claw). Causes damage to the target equal to 1/8 of its maximum HP (1/6 if the user is holding Binding Band)
18,Whirlwind,Normal,Status,True,0,20,The target is forced to switch out and be replaced with a random unfainted ally. Fails if the target is the last unfainted Pokemon in its party
817,Wicked Blow,Dark,Physical,100,80,5,This move is always a critical hit unless the target is under the effect of Lucky Chant or has the Battle Armor or Shell Armor Abilities.
469,Wide Guard,Rock,Status,True,0,10,The user and its party members are protected from moves made by other Pokemon
528,Wild Charge,Electric,Physical,100,90,15,If the target lost HP
261,Will-O-Wisp,Fire,Status,85,0,15,Burns the target.
17,Wing Attack,Flying,Physical,100,60,35,No additional effect.
273,Wish,Normal,Status,True,0,10,At the end of the next turn
110,Withdraw,Water,Status,True,0,40,Raises the user's Defense by 1 stage.
472,Wonder Room,Psychic,Status,True,0,10,For 5 turns
452,Wood Hammer,Grass,Physical,100,120,15,If the target lost HP
526,Work Up,Normal,Status,True,0,30,Raises the user's Attack and Special Attack by 1 stage.
388,Worry Seed,Grass,Status,100,0,10,Causes the target's Ability to become Insomnia. Fails if the target's Ability is Battle Bond
35,Wrap,Normal,Physical,90,15,20,Prevents the target from switching for four or five turns (seven turns if the user is holding Grip Claw). Causes damage to the target equal to 1/8 of its maximum HP (1/6 if the user is holding Binding Band)
378,Wring Out,Normal,Special,100,0,5,Power is equal to 120 * (target's current HP / target's maximum HP)
404,X-Scissor,Bug,Physical,100,80,15,No additional effect.
281,Yawn,Normal,Status,True,0,10,Causes the target to fall asleep at the end of the next turn. Fails when used if the target cannot fall asleep or if it already has a major status condition. At the end of the next turn
192,Zap Cannon,Electric,Special,50,120,5,Has a 100% chance to paralyze the target.
428,Zen Headbutt,Psychic,Physical,90,80,15,Has a 20% chance to flinch the target.
716,Zing Zap,Electric,Physical,100,80,10,Has a 30% chance to flinch the target.
729,Zippy Zap,Electric,Physical,100,80,10,Has a 100% chance to raise the user's evasion by 1 stage.
